{
  "schema_version": "1.0",
  "frameworks": [
    {
      "id": "aws-security-hub",
      "name": "AWS Security Hub CSPM",
      "version": "live",
      "source_url": "https://docs.aws.amazon.com/securityhub/latest/userguide/securityhub-controls-reference.html"
    },
    {
      "id": "cis-aws-foundations",
      "name": "CIS AWS Foundations Benchmark",
      "version": "5.0.0",
      "source_url": "https://docs.aws.amazon.com/securityhub/latest/userguide/cis-aws-foundations-benchmark.html"
    },
    {
      "id": "mitre-attack",
      "name": "MITRE ATT&CK Enterprise",
      "version": "live",
      "source_url": "https://attack.mitre.org/"
    }
  ],
  "rule_count": 35,
  "rules": [
    {
      "rule_id": "IAM-001",
      "module": "iam",
      "title": "Administrator-style wildcard permission",
      "summary": "Detects an Allow statement that grants every action against every resource.",
      "default_severity": "critical",
      "allowed_severities": ["critical"],
      "confidence": "high",
      "confidence_basis": "The analyzer observes an explicit Allow with both Action and Resource set to a full wildcard.",
      "mappings": [
        {
          "framework": "aws-security-hub",
          "control_id": "IAM.1",
          "title": "IAM policies should not allow full administrative privileges",
          "relationship": "direct",
          "url": "https://docs.aws.amazon.com/securityhub/latest/userguide/iam-controls.html#iam-1",
          "rationale": "Both checks identify customer-managed IAM policy statements that allow all actions on all resources."
        }
      ]
    },
    {
      "rule_id": "IAM-002",
      "module": "iam",
      "title": "Wildcard action allowed",
      "summary": "Detects wildcard patterns in allowed IAM actions, including service-wide and partial wildcards.",
      "default_severity": "medium",
      "allowed_severities": ["medium", "high"],
      "confidence": "high",
      "confidence_basis": "The action pattern is explicit policy evidence; severity rises for full or service-wide wildcards.",
      "mappings": [
        {
          "framework": "aws-security-hub",
          "control_id": "IAM.21",
          "title": "IAM customer managed policies that you create should not allow wildcard actions for services",
          "relationship": "related",
          "url": "https://docs.aws.amazon.com/securityhub/latest/userguide/iam-controls.html#iam-21",
          "rationale": "The lab also flags partial wildcard action patterns, so its condition is broader than the Security Hub control."
        }
      ]
    },
    {
      "rule_id": "IAM-003",
      "module": "iam",
      "title": "Wildcard resource scope",
      "summary": "Detects allowed actions that apply to every resource.",
      "default_severity": "medium",
      "allowed_severities": ["medium"],
      "confidence": "high",
      "confidence_basis": "The Resource wildcard is explicit, although some AWS actions do not support resource-level scoping.",
      "mappings": [
        {
          "framework": "aws-security-hub",
          "control_id": "IAM.1",
          "title": "IAM policies should not allow full administrative privileges",
          "relationship": "related",
          "url": "https://docs.aws.amazon.com/securityhub/latest/userguide/iam-controls.html#iam-1",
          "rationale": "Wildcard resource scope contributes to administrative breadth, but this rule can trigger without Action being a full wildcard."
        }
      ]
    },
    {
      "rule_id": "IAM-004",
      "module": "iam",
      "title": "Broad S3 write permission",
      "summary": "Detects write-capable S3 actions granted across wildcard bucket or object resources.",
      "default_severity": "high",
      "allowed_severities": ["high"],
      "confidence": "medium",
      "confidence_basis": "The policy grants broad S3 write capability, but effective access can still be reduced by boundaries, resource policies, or explicit denies.",
      "mappings": [
        {
          "framework": "mitre-attack",
          "control_id": "T1485",
          "title": "Data Destruction",
          "relationship": "related",
          "url": "https://attack.mitre.org/techniques/T1485/",
          "rationale": "Broad S3 write and delete capability can enable destructive impact, but the rule identifies permission rather than observed destruction."
        }
      ]
    },
    {
      "rule_id": "IAM-005",
      "module": "iam",
      "title": "Sensitive action without MFA condition",
      "summary": "Detects privileged user or group permissions that do not require an MFA-present condition.",
      "default_severity": "medium",
      "allowed_severities": ["medium"],
      "confidence": "medium",
      "confidence_basis": "The statement lacks an MFA condition, but other identity controls or session policies may still require MFA.",
      "mappings": [
        {
          "framework": "aws-security-hub",
          "control_id": "IAM.5",
          "title": "MFA should be enabled for all IAM users that have a console password",
          "relationship": "related",
          "url": "https://docs.aws.amazon.com/securityhub/latest/userguide/iam-controls.html#iam-5",
          "rationale": "Both concern MFA protection for IAM users, while this rule evaluates policy conditions rather than credential-report enrollment."
        }
      ]
    },
    {
      "rule_id": "IAM-006",
      "module": "iam",
      "title": "User MFA is disabled",
      "summary": "Detects an IAM user with console-password access and no registered MFA device.",
      "default_severity": "medium",
      "allowed_severities": ["medium"],
      "confidence": "high",
      "confidence_basis": "Credential-report evidence directly states password and MFA status when native AWS input is used.",
      "mappings": [
        {
          "framework": "aws-security-hub",
          "control_id": "IAM.5",
          "title": "MFA should be enabled for all IAM users that have a console password",
          "relationship": "direct",
          "url": "https://docs.aws.amazon.com/securityhub/latest/userguide/iam-controls.html#iam-5",
          "rationale": "The rule and control evaluate the same console-password and MFA enrollment condition."
        },
        {
          "framework": "cis-aws-foundations",
          "control_id": "1.9",
          "title": "Ensure MFA is enabled for all IAM users that have a console password",
          "relationship": "direct",
          "url": "https://docs.aws.amazon.com/securityhub/latest/userguide/cis-aws-foundations-benchmark.html",
          "rationale": "The analyzer directly evaluates the credential-report fields used by this benchmark recommendation."
        }
      ]
    },
    {
      "rule_id": "IAM-007",
      "module": "iam",
      "title": "Long-lived access key",
      "summary": "Detects an active IAM access key older than the analyzer rotation threshold.",
      "default_severity": "medium",
      "allowed_severities": ["medium"],
      "confidence": "high",
      "confidence_basis": "The active status and key age are derived directly from credential-report timestamps.",
      "mappings": [
        {
          "framework": "aws-security-hub",
          "control_id": "IAM.3",
          "title": "IAM users' access keys should be rotated every 90 days or less",
          "relationship": "direct",
          "url": "https://docs.aws.amazon.com/securityhub/latest/userguide/iam-controls.html#iam-3",
          "rationale": "The lab uses the same 90-day rotation threshold as this Security Hub control."
        },
        {
          "framework": "cis-aws-foundations",
          "control_id": "1.13",
          "title": "Ensure access keys are rotated every 90 days or less",
          "relationship": "direct",
          "url": "https://docs.aws.amazon.com/securityhub/latest/userguide/cis-aws-foundations-benchmark.html",
          "rationale": "The analyzer and benchmark recommendation use the same 90-day access-key rotation threshold."
        }
      ]
    },
    {
      "rule_id": "IAM-008",
      "module": "iam",
      "title": "Broad or external role trust",
      "summary": "Detects role trust policies that allow public or cross-account principals, with severity adjusted for recognized guardrails.",
      "default_severity": "high",
      "allowed_severities": ["medium", "high", "critical"],
      "confidence": "medium",
      "confidence_basis": "The external principal is explicit, but effective assumability also depends on caller permissions, conditions, organization boundaries, and external IDs.",
      "mappings": [
        {
          "framework": "mitre-attack",
          "control_id": "T1199",
          "title": "Trusted Relationship",
          "relationship": "related",
          "url": "https://attack.mitre.org/techniques/T1199/",
          "rationale": "Cross-account role trust can expose a trusted access path, but the rule does not establish that an adversary has compromised the trusted party."
        }
      ]
    },
    {
      "rule_id": "IAM-009",
      "module": "iam",
      "title": "Broad allow uses NotAction",
      "summary": "Detects Allow statements that grant the complement of an excluded action list.",
      "default_severity": "medium",
      "allowed_severities": ["medium", "high"],
      "confidence": "high",
      "confidence_basis": "NotAction is explicit policy syntax; severity rises when the statement also applies to every resource.",
      "mappings": [
        {
          "framework": "aws-security-hub",
          "control_id": "IAM.1",
          "title": "IAM policies should not allow full administrative privileges",
          "relationship": "related",
          "url": "https://docs.aws.amazon.com/securityhub/latest/userguide/iam-controls.html#iam-1",
          "rationale": "An Allow with NotAction can approach administrative breadth, but it is not necessarily equivalent to allowing every action."
        }
      ]